{
  "id": "workload.streaming",
  "schemaVersion": 1,
  "name": "Streaming",
  "description": "Evening-peaked bandwidth-heavy delivery. Caching and regional placement decide the margin.",
  "revenueFactor": 1.1,
  "uptimeRequirement01": 0.9,
  "latencySensitivity01": 0.72,
  "flexibility01": 0.3,
  "priceSensitivity01": 0.48,
  "penaltyClass": "medium",
  "compatibleFamilies": [
    "cpu",
    "storage",
    "gpu"
  ],
  "hourlyDemandShape": [
    1.318,
    1.225,
    1.116,
    1,
    0.884,
    0.775,
    0.682,
    0.61,
    0.565,
    0.55,
    0.565,
    0.61,
    0.682,
    0.775,
    0.884,
    1,
    1.116,
    1.225,
    1.318,
    1.39,
    1.435,
    1.45,
    1.435,
    1.39
  ],
  "meanUtilization01": 0.62,
  "latencyToleranceMs": 80,
  "availableFromYear": 1995
}
