{
  "id": "workload.archive",
  "schemaVersion": 1,
  "name": "Archive",
  "description": "Long-term retention at low compute intensity. Stable base load that rewards long hardware life.",
  "revenueFactor": 0.55,
  "uptimeRequirement01": 0.7,
  "latencySensitivity01": 0.1,
  "flexibility01": 0.75,
  "priceSensitivity01": 0.75,
  "penaltyClass": "low",
  "compatibleFamilies": [
    "storage",
    "archive",
    "cpu"
  ],
  "hourlyDemandShape": [
    1,
    1,
    1,
    1,
    1,
    1,
    1,
    1,
    1,
    1,
    1,
    1,
    1,
    1,
    1,
    1,
    1,
    1,
    1,
    1,
    1,
    1,
    1,
    1
  ],
  "meanUtilization01": 0.35,
  "latencyToleranceMs": 400,
  "availableFromYear": 1995
}
