{
  "id": "workload.finance",
  "schemaVersion": 1,
  "name": "Financial Services",
  "description": "The premium anchor tenant. Near-perfect uptime and single-digit latency, with penalties to match.",
  "revenueFactor": 2.1,
  "uptimeRequirement01": 0.99,
  "latencySensitivity01": 0.98,
  "flexibility01": 0.05,
  "priceSensitivity01": 0.12,
  "penaltyClass": "extreme",
  "compatibleFamilies": [
    "cpu",
    "storage"
  ],
  "hourlyDemandShape": [
    0.71,
    0.74,
    0.788,
    0.85,
    0.922,
    1,
    1.078,
    1.15,
    1.212,
    1.26,
    1.29,
    1.3,
    1.29,
    1.26,
    1.212,
    1.15,
    1.078,
    1,
    0.922,
    0.85,
    0.788,
    0.74,
    0.71,
    0.7
  ],
  "meanUtilization01": 0.55,
  "latencyToleranceMs": 15,
  "availableFromYear": 1995
}
