{
  "id": "workload.ai_inference",
  "schemaVersion": 1,
  "name": "AI Inference",
  "description": "Latency-sensitive serving that follows the working day. Premium pricing, little scheduling freedom.",
  "revenueFactor": 1.8,
  "uptimeRequirement01": 0.92,
  "latencySensitivity01": 0.82,
  "flexibility01": 0.35,
  "priceSensitivity01": 0.4,
  "penaltyClass": "high",
  "compatibleFamilies": [
    "gpu",
    "asic",
    "cpu"
  ],
  "hourlyDemandShape": [
    0.753,
    0.697,
    0.662,
    0.65,
    0.662,
    0.697,
    0.753,
    0.825,
    0.909,
    1,
    1.091,
    1.175,
    1.247,
    1.303,
    1.338,
    1.35,
    1.338,
    1.303,
    1.247,
    1.175,
    1.091,
    1,
    0.909,
    0.825
  ],
  "meanUtilization01": 0.68,
  "latencyToleranceMs": 60,
  "availableFromYear": 2018
}
