{
  "id": "workload.batch_science",
  "schemaVersion": 1,
  "name": "Scientific Batch",
  "description": "Large schedulable jobs. Defers freely, which makes it the natural partner for carbon-aware scheduling.",
  "revenueFactor": 0.9,
  "uptimeRequirement01": 0.65,
  "latencySensitivity01": 0.12,
  "flexibility01": 0.9,
  "priceSensitivity01": 0.82,
  "penaltyClass": "medium",
  "compatibleFamilies": [
    "cpu",
    "gpu",
    "experimental"
  ],
  "hourlyDemandShape": [
    1,
    1,
    1,
    1,
    1,
    1,
    1,
    1,
    1,
    1,
    1,
    1,
    1,
    1,
    1,
    1,
    1,
    1,
    1,
    1,
    1,
    1,
    1,
    1
  ],
  "meanUtilization01": 0.75,
  "latencyToleranceMs": 250,
  "availableFromYear": 1995
}
