{
  "id": "workload.disaster_recovery",
  "schemaVersion": 1,
  "name": "Disaster Recovery",
  "description": "Capacity that mostly idles and must be flawless the hour it is called. Reserve revenue for reserved capacity.",
  "revenueFactor": 1.25,
  "uptimeRequirement01": 0.995,
  "latencySensitivity01": 0.45,
  "flexibility01": 0.1,
  "priceSensitivity01": 0.15,
  "penaltyClass": "extreme",
  "compatibleFamilies": [
    "cpu",
    "storage",
    "archive"
  ],
  "hourlyDemandShape": [
    1,
    1,
    1,
    1,
    1,
    1,
    1,
    1,
    1,
    1,
    1,
    1,
    1,
    1,
    1,
    1,
    1,
    1,
    1,
    1,
    1,
    1,
    1,
    1
  ],
  "meanUtilization01": 0.22,
  "latencyToleranceMs": 150,
  "availableFromYear": 1995
}
