{
  "id": "workload.government",
  "schemaVersion": 1,
  "name": "Government",
  "description": "Stable contracted revenue under residency and compliance scrutiny that never relaxes.",
  "revenueFactor": 1.35,
  "uptimeRequirement01": 0.96,
  "latencySensitivity01": 0.62,
  "flexibility01": 0.2,
  "priceSensitivity01": 0.25,
  "penaltyClass": "extreme",
  "compatibleFamilies": [
    "cpu",
    "storage",
    "archive"
  ],
  "hourlyDemandShape": [
    0.75,
    0.759,
    0.783,
    0.823,
    0.875,
    0.935,
    1,
    1.065,
    1.125,
    1.177,
    1.217,
    1.241,
    1.25,
    1.241,
    1.217,
    1.177,
    1.125,
    1.065,
    1,
    0.935,
    0.875,
    0.823,
    0.783,
    0.759
  ],
  "meanUtilization01": 0.58,
  "latencyToleranceMs": 100,
  "availableFromYear": 1995
}
