{
  "id": "workload.ai_training",
  "schemaVersion": 1,
  "name": "AI Training",
  "description": "Dense deadline-bound training runs. Shiftable within the deadline, which is where the renewable strategy lives.",
  "revenueFactor": 1.65,
  "uptimeRequirement01": 0.72,
  "latencySensitivity01": 0.18,
  "flexibility01": 0.82,
  "priceSensitivity01": 0.72,
  "penaltyClass": "high",
  "compatibleFamilies": [
    "gpu",
    "asic"
  ],
  "hourlyDemandShape": [
    1,
    1,
    1,
    1,
    1,
    1,
    1,
    1,
    1,
    1,
    1,
    1,
    1,
    1,
    1,
    1,
    1,
    1,
    1,
    1,
    1,
    1,
    1,
    1
  ],
  "meanUtilization01": 0.92,
  "latencyToleranceMs": 200,
  "availableFromYear": 2016
}
